{
  "schemaVersion": "0.1",
  "rubricVersion": "0.1",
  "metadata": {
    "projectId": "menulens",
    "title": "MenuLens",
    "language": "en",
    "createdAt": "2026-10-23T14:02:00+07:00",
    "updatedAt": "2026-10-23T15:31:00+07:00",
    "maturity": "idea"
  },
  "session": {
    "mode": "deep",
    "tone": "standard",
    "stage": "build-mvp",
    "gate": 90,
    "phase": 2,
    "turns": 11,
    "overrides": []
  },
  "capabilities": {
    "fileWrite": true,
    "scripts": true,
    "browsing": false,
    "attachments": true,
    "archify": false
  },
  "ws": {
    "why": {
      "summary": "Allergy travelers cannot tell what is safe to order from a menu they cannot read",
      "ratings": [
        {
          "criterion": "pain-severity",
          "rating": 4,
          "rationale": "For a traveler with celiac disease or a nut allergy, every restaurant meal abroad is a risk decision. The user eats out 2 to 3 times a day on a trip and reports skipping meals or eating only packaged food on past trips. One bad dish costs a day of the trip.",
          "evidence": "user",
          "sources": [
            "SRC-001",
            "SRC-002"
          ]
        },
        {
          "criterion": "broken-workaround",
          "rating": 4,
          "rationale": "Google Lens translates words literally: it renders a dish name but not what is in it. Printed allergy cards get a nod from staff who do not read them carefully. Asking the waiter fails across the language barrier. Three linked r/Celiac threads describe the same pattern.",
          "evidence": "source",
          "sources": [
            "SRC-002"
          ]
        },
        {
          "criterion": "value-capture",
          "rating": 3,
          "rationale": "Hypothesis: a one-trip pass at 4.99 USD or 19.99 USD a year. The allergy traveler already spends on cards and apps. Cost per trip estimated at roughly 0.14 USD in model calls (see ASM-002). Willingness to pay is untested.",
          "evidence": "assumption",
          "links": [
            "ASM-001",
            "ASM-002",
            "EXP-001"
          ]
        },
        {
          "criterion": "success-metric",
          "rating": 4,
          "rationale": "Success: at least 60 percent of scans end with the user tapping \"I ordered this\" within the session. Kill signal: under 20 percent after the first 200 users, or more than two reports of a flagged dish that was unsafe.",
          "evidence": "user",
          "links": [
            "EXP-002"
          ]
        }
      ],
      "caps": [
        {
          "id": "why-no-workaround",
          "active": false,
          "reason": "Cleared in turn 2: workarounds named with their failure"
        }
      ],
      "links": [
        "DEC-002"
      ],
      "score": 94
    },
    "who": {
      "summary": "English-speaking travelers with celiac disease or a severe food allergy, 2 or more trips a year to a country whose script they cannot read",
      "ratings": [
        {
          "criterion": "beachhead-persona",
          "rating": 4,
          "rationale": "PERSONA-001: an English-speaking traveler with celiac disease or a severe allergy, planning a trip to Japan, Thailand or Italy, who already carries a printed allergy card. The product appears when they sit down and open the menu.",
          "evidence": "user",
          "links": [
            "PERSONA-001"
          ],
          "sources": [
            "SRC-001",
            "SRC-002"
          ]
        },
        {
          "criterion": "switching-trigger-and-objections",
          "rating": 4,
          "rationale": "Trigger: booking a trip to a non-Latin-script country. Objections: can I trust an allergen flag with my health, what does it cost in roaming data, and \"I already use Google Translate\".",
          "evidence": "source",
          "sources": [
            "SRC-002"
          ],
          "links": [
            "EDGE-003"
          ]
        },
        {
          "criterion": "distribution",
          "rating": 3,
          "rationale": "r/Celiac, r/JapanTravel, two Facebook celiac travel groups and three allergy travel bloggers. The builder has celiac disease and posts in two of these communities, so the first fifty are reachable. No channel has been tested.",
          "evidence": "user",
          "links": [
            "EXP-001"
          ]
        },
        {
          "criterion": "buyer-user-anti-persona",
          "rating": 4,
          "rationale": "Buyer and user are the same person. Anti-persona PERSONA-002: foodies without restrictions who enjoy ordering blind, and business travelers eating at hotels with English menus. Both excluded from v1 messaging and features.",
          "evidence": "user",
          "links": [
            "PERSONA-002",
            "DEC-002"
          ]
        }
      ],
      "caps": [
        {
          "id": "who-everyone",
          "active": false,
          "reason": "Cleared in turn 3: beachhead narrowed to allergy travelers"
        }
      ],
      "links": [
        "PERSONA-001",
        "PERSONA-002"
      ],
      "score": 94
    },
    "what": {
      "summary": "Photo of a menu to dish cards with allergen flags for the user's profile, plus a local-language question card",
      "ratings": [
        {
          "criterion": "core-loop",
          "rating": 4,
          "rationale": "MenuLens turns a photo of a menu into dish cards that say what each dish is, its main ingredients, and which of the user's allergens it may contain, then gives a phrase in the local language to confirm with staff. One photo, one answer, one question to ask.",
          "evidence": "user",
          "links": [
            "REQ-001",
            "REQ-002"
          ]
        },
        {
          "criterion": "v1-must-haves",
          "rating": 4,
          "rationale": "Four features with acceptance criteria: allergy profile setup (REQ-001), menu photo to dish cards with flags (REQ-002), local-language confirmation card (REQ-003), cache of the last 20 scanned menus for offline re-reading (REQ-004).",
          "evidence": "user",
          "links": [
            "REQ-001",
            "REQ-002",
            "REQ-003",
            "REQ-004"
          ]
        },
        {
          "criterion": "explicit-anti-scope",
          "rating": 4,
          "rationale": "Cut from v1 (DEC-003): dish recommendations and ranking, restaurant reviews, social sharing, favorites sync across devices, live camera translation, fully offline recognition. Google Lens remains the right tool for a traveler who only needs literal translation.",
          "evidence": "user",
          "links": [
            "DEC-003"
          ]
        },
        {
          "criterion": "day-one-inputs",
          "rating": 3,
          "rationale": "The user brings an allergy profile, a destination language and a camera. Business rule: a flag is a warning to confirm, never a clearance. Profile edge cases (multiple severe allergies, cross-contamination) are recorded as EDGE-003 and EDGE-004.",
          "evidence": "user",
          "links": [
            "EDGE-003",
            "EDGE-004"
          ]
        }
      ],
      "caps": [
        {
          "id": "what-unbounded-scope",
          "active": false,
          "reason": "Cleared in turn 5: four features and a named anti-scope list"
        }
      ],
      "links": [
        "DEC-003"
      ],
      "score": 95
    },
    "which": {
      "summary": "Mobile web app installed to the home screen; native deferred until retention is shown",
      "ratings": [
        {
          "criterion": "primary-form-factor",
          "rating": 4,
          "rationale": "DEC-001: a mobile web app with camera access and add-to-home-screen. Rejected: native iOS and Android for v1 (store review and two codebases in six weeks), a Telegram bot (no camera flow), a desktop site (wrong moment).",
          "evidence": "user",
          "links": [
            "DEC-001"
          ]
        },
        {
          "criterion": "workflow-fit",
          "rating": 4,
          "rationale": "The traveler already has the phone out to photograph the menu. A link on the home screen that opens the camera matches that moment with no store download on hotel Wi-Fi.",
          "evidence": "assumption",
          "links": [
            "PERSONA-001"
          ]
        },
        {
          "criterion": "device-and-environment-constraints",
          "rating": 4,
          "rationale": "Restaurants abroad mean roaming data and basements with one bar of signal. Images are compressed on the device before upload, results are cached, and the app degrades to the cached menus when offline (EDGE-002). Large text and labeled controls for one-handed use at a table.",
          "evidence": "user",
          "links": [
            "EDGE-002",
            "REQ-004"
          ]
        },
        {
          "criterion": "integration-boundary",
          "rating": 3,
          "rationale": "One vision model API behind a thin server. No restaurant data, maps or payment APIs in v1. Provider choice is open until EXP-002 measures accuracy and latency.",
          "evidence": "assumption",
          "links": [
            "EXP-002",
            "RISK-003"
          ]
        }
      ],
      "caps": [
        {
          "id": "which-native-without-reason",
          "active": false,
          "reason": "Cleared in turn 6: web app chosen over native"
        }
      ],
      "links": [
        "DEC-001"
      ],
      "score": 95
    },
    "whether": {
      "summary": "Provisional 0.012 USD per scan against a 4.99 USD trip pass; allergen liability handled as a confirm-with-staff flow, not a clearance",
      "ratings": [
        {
          "criterion": "unit-economics",
          "rating": 4,